channel_name,title,publishedAt,views,likes,comments,duration_min,is_short,weekday,hour,title_length,engagement
Clément Mihailescu,Can I Pass A Software Engineering Quiz Created By ChatGPT?,2025-06-05 13:30:18+00:00,5276,100,31,14.35,False,Thursday,13,58,0.024829416224412433
Clément Mihailescu,The End Of Remote Work,2024-10-07 13:30:29+00:00,27617,539,174,12.62,False,Monday,13,22,0.025817431292319948
Clément Mihailescu,The Era Of The Solo Founder,2024-09-18 13:30:13+00:00,21466,832,106,8.72,False,Wednesday,13,27,0.043697009223888944
Clément Mihailescu,The Coding Bootcamp Apocalypse Of 2024,2024-09-04 13:30:25+00:00,46895,962,277,17.25,False,Wednesday,13,38,0.026420727156413262
Clément Mihailescu,The True Impact Of AI On Software Engineering,2024-08-27 13:30:35+00:00,50692,1262,253,12.73,False,Tuesday,13,45,0.029886372603172097
Clément Mihailescu,My Honest Thoughts On The Software Engineering Market In 2024,2024-08-20 13:30:19+00:00,397615,9605,3054,22.78,False,Tuesday,13,61,0.03183733008060561
Clément Mihailescu,5 Uncomfortable Truths Of Life,2024-08-15 13:30:31+00:00,12051,481,184,10.78,False,Thursday,13,30,0.05518214256078334
Clément Mihailescu,No-BS Advice For People In Their 20s,2024-08-12 13:30:13+00:00,14037,636,121,12.97,False,Monday,13,36,0.05392890218707701
Clément Mihailescu,What My Life Is Like After Running A Successful Business For 7 Years,2024-08-06 13:30:02+00:00,28997,1005,315,17.1,False,Tuesday,13,68,0.04552195054660827
Clément Mihailescu,The Easiest Way To Get A Tech Job In 2024,2024-04-19 13:30:24+00:00,35162,837,149,8.02,False,Friday,13,41,0.028041635856890963
Clément Mihailescu,Why Devin AI WON'T Take Your Job,2024-04-09 13:30:23+00:00,15203,514,82,6.55,False,Tuesday,13,32,0.039202788923238835
Clément Mihailescu,Where I've Been,2023-11-25 00:30:16+00:00,36782,706,125,5.0,False,Saturday,0,15,0.022592572453917676
Clément Mihailescu,The 5 Stages Of A Software Engineer's Life,2023-07-10 13:30:02+00:00,26477,672,103,11.43,False,Monday,13,42,0.029270687766740945
Clément Mihailescu,My Girlfriend Reacts To AlgoExpert Ad Comments,2023-07-03 13:30:05+00:00,92807,720,317,16.67,False,Monday,13,46,0.011173726119796999
Clément Mihailescu,The Dumbest Trend In Tech,2023-06-19 13:30:15+00:00,16560,404,82,11.15,False,Monday,13,25,0.029347826086956522
Clément Mihailescu,Why You Suck At Coding,2023-06-12 13:30:17+00:00,23957,870,80,7.13,False,Monday,13,22,0.039654380765538254
Clément Mihailescu,8 Most Important Character Traits Of Successful People,2023-06-05 13:30:07+00:00,9382,457,38,9.2,False,Monday,13,54,0.05276060541462375
Clément Mihailescu,How To Become A $500K-Per-Year Software Engineer,2023-06-01 13:30:04+00:00,69616,1713,100,11.92,False,Thursday,13,48,0.026042863709492072
Clément Mihailescu,5 Money Lessons After Making Millions,2023-05-29 13:30:12+00:00,13898,666,59,13.77,False,Monday,13,37,0.05216577924881278
Clément Mihailescu,The Pain Of Not Finding A Software Engineering Job,2023-05-25 13:30:20+00:00,107575,2940,413,11.33,False,Thursday,13,50,0.031168951894027422
Clément Mihailescu,"How Much Money I've Made As A Software Engineer, Entrepreneur, And YouTuber",2023-05-22 13:30:13+00:00,72889,4368,232,14.3,False,Monday,13,75,0.06310965989381113
Clément Mihailescu,The State Of The Tech Industry In 2023,2023-05-18 13:30:03+00:00,41008,1148,134,13.22,False,Thursday,13,38,0.03126219274287944
Clément Mihailescu,Should You Bootstrap Or Raise Funding For Your Startup? (pros and cons),2023-02-27 14:30:08+00:00,9922,250,34,15.08,False,Monday,14,71,0.02862326143922596
Clément Mihailescu,Everything You Need To Know About Being A Blockchain Engineer,2023-02-21 14:30:08+00:00,21575,830,46,17.35,False,Tuesday,14,61,0.04060254924681344
Clément Mihailescu,AI Meets Crypto - The Next Big Thing In Tech,2023-02-11 14:30:04+00:00,9941,305,41,3.85,False,Saturday,14,44,0.0348053515742883
Clément Mihailescu,From Lawyer To Google Software Engineer (at 39 years old),2023-02-06 14:30:09+00:00,30452,732,43,24.33,False,Monday,14,57,0.02544988834887692
Clément Mihailescu,The Best Algorithm Ever - The Ostrich Algorithm,2023-02-03 14:30:30+00:00,14976,480,33,5.25,False,Friday,14,47,0.034254807692307696
Clément Mihailescu,How To Get Lucky (the hidden secret to success),2023-01-30 14:30:03+00:00,11999,578,38,7.3,False,Monday,14,47,0.0513376114676223
Clément Mihailescu,The Great Software Engineering Panic Of 2023,2023-01-26 14:30:06+00:00,112652,2711,465,8.93,False,Thursday,14,44,0.02819301920960125
Clément Mihailescu,Google Layoffs,2023-01-21 14:30:01+00:00,49972,1204,204,3.53,False,Saturday,14,14,0.028175778435924118
Clément Mihailescu,The FAANG Outlook In 2023,2023-01-18 14:30:00+00:00,28126,689,99,9.13,False,Wednesday,14,25,0.028016781625542202
Clément Mihailescu,Will Twitter Survive After So Many Layoffs?,2023-01-16 14:30:09+00:00,7270,278,85,7.52,False,Monday,14,43,0.049931224209078404
Clément Mihailescu,How To Find Your Purpose In Life,2023-01-13 14:30:15+00:00,8278,423,47,10.97,False,Friday,14,32,0.05677699927518724
Clément Mihailescu,Is ChatGPT The End Of Coding Interviews?,2023-01-11 14:30:00+00:00,39688,705,166,7.27,False,Wednesday,14,40,0.02194618020560371
Clément Mihailescu,Complete This Challenge To Dramatically Improve Your Life,2023-01-09 14:30:16+00:00,18375,1308,389,5.8,False,Monday,14,57,0.09235374149659864
Clément Mihailescu,The Easiest Way To Become A Millionaire In 2023,2022-12-26 14:00:19+00:00,124981,1512,110,7.82,False,Monday,14,47,0.01297797265184308
Clément Mihailescu,Will ChatGPT Replace Software Engineers? (full analysis),2022-12-20 14:00:13+00:00,145327,3407,861,22.07,False,Tuesday,14,56,0.029368252286223483
Clément Mihailescu,10 Insane ChatGPT Applications (artificial intelligence),2022-12-16 14:00:07+00:00,133744,2938,311,15.72,False,Friday,14,56,0.024292678550065797
Clément Mihailescu,Google Coding Interview With An Artificial Intelligence (ChatGPT),2022-12-13 14:00:30+00:00,228388,5104,513,31.08,False,Tuesday,14,65,0.024594111774699196
Clément Mihailescu,FAANG Software Engineers Before And During A Recession,2022-12-07 14:30:03+00:00,50355,816,65,3.97,False,Wednesday,14,54,0.017495779962267897
Clément Mihailescu,Software Engineering Trends For The Next Decade (the 2020s),2022-11-28 14:00:14+00:00,32157,885,140,6.68,False,Monday,14,59,0.031874863948751435
Clément Mihailescu,Is Now A Good Time To Become A Blockchain Engineer?,2022-11-25 15:15:00+00:00,19834,590,117,9.5,False,Friday,15,51,0.035645860643339716
Clément Mihailescu,What To Do If You've Been Laid Off In Tech,2022-11-07 15:00:09+00:00,28757,803,90,9.35,False,Monday,15,42,0.031053308759606355
Clément Mihailescu,What's Going On With Big Tech...? (tech recession),2022-11-01 14:00:18+00:00,200732,4816,576,12.47,False,Tuesday,14,50,0.02686168622840404
Clément Mihailescu,8 Passive Income Ideas For Software Engineers,2022-09-26 14:00:18+00:00,68415,1348,117,13.53,False,Monday,14,45,0.021413432726741212
Clément Mihailescu,5 Things Every Software Engineer Should Do,2022-09-20 14:00:03+00:00,22986,733,54,9.85,False,Tuesday,14,42,0.034238231967284434
Clément Mihailescu,Why You're Not Gonna Make It (as a software engineer or entrepreneur),2022-09-12 13:00:06+00:00,47276,2429,268,9.72,False,Monday,13,69,0.05704797360182757
Clément Mihailescu,Is FAANG Still Worth It For Software Engineers In 2022?,2022-09-02 14:00:16+00:00,53035,1281,198,8.98,False,Friday,14,55,0.027887244272650137
Clément Mihailescu,5 Programming Project Ideas (for beginners and experts),2022-08-22 14:00:06+00:00,126588,3740,143,8.57,False,Monday,14,55,0.03067431352102885
Clément Mihailescu,Ex-Google Software Engineer Speeds Through 3 Coding Interview Problems,2022-08-18 14:00:19+00:00,103141,2049,276,59.38,False,Thursday,14,70,0.022541957126651864
Clément Mihailescu,20 Pieces Of Advice For My Younger Self (as a 27 year old CEO),2022-07-30 13:30:16+00:00,30106,1814,140,10.52,False,Saturday,13,62,0.06490400584601076
Clément Mihailescu,The BEST Coding Interview Question Ever,2022-07-17 14:00:18+00:00,37495,1220,117,9.95,False,Sunday,14,39,0.03565808774503267
Clément Mihailescu,Software Engineer Ranks Programming Languages,2022-07-08 14:00:03+00:00,895965,14997,6168,15.28,False,Friday,14,45,0.023622574542532353
Clément Mihailescu,When An Ex-Google Software Engineer Runs A Non-Profit,2022-07-06 14:00:20+00:00,10532,275,26,23.35,False,Wednesday,14,53,0.028579567033801746
Clément Mihailescu,I Forgot How To Code!,2022-07-03 14:00:06+00:00,36163,1042,130,10.82,False,Sunday,14,21,0.03240881564029533
Clément Mihailescu,Nuggets of Wisdom - High School Graduation Speech 2022 (FASNY),2022-06-17 13:30:01+00:00,25937,657,47,9.67,False,Friday,13,62,0.027142691907313877
Clément Mihailescu,Google JavaScript Interview With A Frontend Engineer,2022-06-09 14:00:19+00:00,215368,4831,254,52.58,False,Thursday,14,52,0.02361074997214071
Clément Mihailescu,22 Questions With An Ex-Google Senior Engineering Leader,2022-06-02 14:30:06+00:00,51034,1536,57,21.67,False,Thursday,14,56,0.0312144844613395
Clément Mihailescu,Working 2 Software Engineering Jobs At The Same Time,2022-05-16 14:00:07+00:00,72155,1877,217,10.05,False,Monday,14,52,0.02902085787540711
Clément Mihailescu,The Software Engineering Bubble Just Popped,2022-05-09 14:00:23+00:00,164394,5178,414,9.87,False,Monday,14,43,0.03401583999416037
Clément Mihailescu,How To Better Handle Stress,2022-05-05 14:00:00+00:00,22172,1055,58,11.65,False,Thursday,14,27,0.050198448493595525
Clément Mihailescu,Career Advice For Your 20s,2022-04-30 14:00:36+00:00,86376,4629,260,8.33,False,Saturday,14,26,0.056601370751134576
Clément Mihailescu,What You Don't Realize About FAANG (for software engineers),2022-04-19 14:00:06+00:00,60702,1835,110,10.55,False,Tuesday,14,59,0.03204177786563869
Clément Mihailescu,Google Frontend Interview With A Frontend Expert,2022-04-13 13:30:00+00:00,1090218,20573,445,47.98,False,Wednesday,13,48,0.019278713064726505
Clément Mihailescu,INSANE AI Creates Realistic Images From Text! (DALL-E 2 OpenAI),2022-04-08 14:00:30+00:00,74725,2577,305,8.58,False,Friday,14,63,0.03856808297089327
Clément Mihailescu,I'm Back To Working At Google - As A Product Manager,2022-04-01 13:30:01+00:00,88797,4920,457,4.33,False,Friday,13,52,0.060553847539894366
Clément Mihailescu,How Many Hours Should You Code Per Day?,2022-02-17 14:30:24+00:00,44813,1711,108,7.12,False,Thursday,14,39,0.04059089996206458
Clément Mihailescu,Why Do Software Engineers Leave FAANG?,2022-02-14 14:30:02+00:00,128426,3929,251,7.5,False,Monday,14,38,0.03254792643234236
Clément Mihailescu,Avoid These 3 Traps As A Software Engineer,2022-02-08 14:30:04+00:00,51738,2058,98,6.4,False,Tuesday,14,42,0.04167149870501372
Clément Mihailescu,ProgrammingExpert | Learn To Code,2022-02-03 14:45:00+00:00,6448104,5413,572,0.78,True,Thursday,14,33,0.000928179818439653
Clément Mihailescu,Tips To Build A Business As A Software Engineer,2022-02-01 14:00:13+00:00,76519,3692,193,6.97,False,Tuesday,14,47,0.050771703759850496
Clément Mihailescu,Watch This If You Feel Like You Don't Have Enough Time,2022-01-28 14:00:11+00:00,29934,1862,100,6.35,False,Friday,14,54,0.06554419723391461
Clément Mihailescu,Is CSS Really That Hard?,2022-01-25 16:30:01+00:00,26171,1199,141,10.97,False,Tuesday,16,24,0.05120171181842498
Clément Mihailescu,I Failed My 2021 New Year's Goals (plus 2022 goals),2021-12-31 14:00:32+00:00,17020,608,85,10.93,False,Friday,14,51,0.04071680376028202
Clément Mihailescu,FrontendExpert | Ace the Frontend Interviews,2021-12-15 15:00:05+00:00,2864132,7112,1771,0.73,True,Wednesday,15,44,0.0031014632007184025
Clément Mihailescu,5 Years Of Coding In 10 Minutes,2021-12-06 13:45:00+00:00,35639,1246,70,11.28,False,Monday,13,31,0.03692583967002441
Clément Mihailescu,How To Be Extremely Productive,2021-11-29 14:00:32+00:00,36916,1899,100,9.67,False,Monday,14,30,0.05414996207606458
Clément Mihailescu,How To Become A Self-Taught Programmer,2021-11-26 18:15:00+00:00,45514,2267,169,13.22,False,Friday,18,38,0.05352199323285143
Clément Mihailescu,Announcing FrontendExpert - Frontend Interview Prep Platform,2021-11-24 16:00:20+00:00,22150,1029,166,5.42,False,Wednesday,16,60,0.05395033860045147
Clément Mihailescu,10 Things Every Programmer Hates,2021-11-01 13:30:02+00:00,21011,1110,162,9.93,False,Monday,13,32,0.06053971729094284
Clément Mihailescu,I Had A Quarter-Life Crisis,2021-10-26 13:30:01+00:00,45306,2236,296,12.37,False,Tuesday,13,27,0.05588663753145279
Clément Mihailescu,15 Reasons To Become A Software Engineer,2021-09-27 14:00:04+00:00,31909,1454,131,17.75,False,Monday,14,40,0.04967250618947632
Clément Mihailescu,Why The Logarithm Is So Important For Algorithms & Data Structures,2021-09-20 14:00:20+00:00,95151,5599,224,10.08,False,Monday,14,66,0.06119746508181732
Clément Mihailescu,So I've Been Coding A Lot Lately...,2021-09-13 14:00:29+00:00,69951,2924,174,9.43,False,Monday,14,35,0.04428814455833369
Clément Mihailescu,Am I Going Back To Google?,2021-08-30 12:45:01+00:00,48318,1626,155,9.48,False,Monday,12,26,0.03685996936959311
Clément Mihailescu,Why Some Software Engineers Fail,2021-08-15 14:00:25+00:00,43749,1992,141,11.25,False,Sunday,14,32,0.048755400123431394
Clément Mihailescu,My Regrets As A Software Engineer,2021-08-12 14:00:27+00:00,22992,1087,102,9.48,False,Thursday,14,33,0.05171363952679193
Clément Mihailescu,Are Software Engineers Overpaid?,2021-08-08 15:00:25+00:00,38791,1981,310,8.95,False,Sunday,15,32,0.05906009125828156
Clément Mihailescu,How Important Is Luck In Coding Interviews?,2021-07-25 12:00:05+00:00,27396,1525,147,5.93,False,Sunday,12,43,0.06103080741714119
Clément Mihailescu,Cheddar Cheese,2021-07-19 13:00:16+00:00,23034,1834,237,4.57,False,Monday,13,14,0.08991056698793089
Clément Mihailescu,AlgoExpert Is Hiring!,2021-07-13 14:00:13+00:00,30067,1111,239,8.03,False,Tuesday,14,21,0.044899723949845344
Clément Mihailescu,The 7 Best Purchases I've Made In My 20s,2021-07-10 14:00:17+00:00,22715,900,84,8.08,False,Saturday,14,40,0.043319392471934844
Clément Mihailescu,The 10 Most Important Concepts For Coding Interviews (algorithms and data structures),2021-07-02 13:15:01+00:00,479615,16508,294,13.3,False,Friday,13,85,0.03503226546292339
Clément Mihailescu,I Don't Know What I'm Doing (and neither do you),2021-06-27 13:30:02+00:00,23364,1493,137,8.97,False,Sunday,13,48,0.06976545112138333
Clément Mihailescu,My Ultra Minimalist Desk Setup For Productivity,2021-06-21 13:00:01+00:00,41600,1379,262,11.15,False,Monday,13,47,0.039447115384615386
Clément Mihailescu,Medium Google Coding Interview With Ben Awad,2021-06-10 14:00:06+00:00,1381448,21965,1077,51.45,False,Thursday,14,44,0.01667959995598821
Clément Mihailescu,How To Stay Motivated While Working In Tech,2021-06-07 13:00:08+00:00,26505,1313,85,10.15,False,Monday,13,43,0.05274476513865308
Clément Mihailescu,What Does A Machine Learning Engineer At Amazon Do?,2021-05-28 13:00:32+00:00,130843,3993,159,21.37,False,Friday,13,51,0.031732687266418536
Clément Mihailescu,Announcing MLExpert - Machine Learning Interview Prep Platform,2021-05-25 16:45:03+00:00,30954,1726,236,6.83,False,Tuesday,16,62,0.06338437681721264
Clément Mihailescu,How To Choose Your Specialization As A Software Engineer,2021-05-17 14:00:09+00:00,157434,6175,229,9.65,False,Monday,14,56,0.0406773632125208
Clément Mihailescu,4 Tips For Running A Side Business With A Full-Time Job,2021-05-02 14:00:20+00:00,24823,1323,91,13.73,False,Sunday,14,55,0.0569633001651694
Clément Mihailescu,What Does A Staff Software Engineer At FAANG Do?,2021-04-26 14:00:13+00:00,210526,5375,211,23.87,False,Monday,14,48,0.0265335398003097
Clément Mihailescu,4 Common Mistakes In Coding Interviews,2021-04-24 14:00:30+00:00,126090,4934,154,10.27,False,Saturday,14,38,0.040352129431358554
Clément Mihailescu,How To Become An Engineering Manager (ft. Tom Weingarten),2021-04-22 13:00:09+00:00,62181,1798,62,14.0,False,Thursday,13,57,0.029912674289573987
Clément Mihailescu,What Does A Google Engineering Manager Do? (ft. Tom Weingarten),2021-04-19 13:00:17+00:00,149495,3873,140,25.32,False,Monday,13,63,0.026843707147396235
Clément Mihailescu,Stop Trying To Be Productive (toxic productivity),2021-04-17 13:30:01+00:00,28878,1717,165,9.57,False,Saturday,13,49,0.06517071819378073
Clément Mihailescu,The Difference Between A Software Engineer And A Software Developer,2021-04-08 13:00:03+00:00,210935,9432,569,7.23,False,Thursday,13,67,0.04741271007656387
Clément Mihailescu,4 Controversial Pieces Of Advice To Be Successful (from a 26 year old CEO),2021-04-05 13:30:01+00:00,25861,1494,205,15.8,False,Monday,13,74,0.06569738215846255
Clément Mihailescu,Top 10 Web Development Tips You Need To Know!,2021-03-27 14:30:03+00:00,60147,3238,165,15.78,False,Saturday,14,45,0.05657805044308112
Clément Mihailescu,How Good Are You At JavaScript? - JavaScript QUIZ!,2021-03-24 13:30:04+00:00,37330,1397,131,33.22,False,Wednesday,13,50,0.04093222609161532
Clément Mihailescu,I Built A Snake Game By Reversing A Linked List (JavaScript & React project tutorial),2021-03-21 13:15:01+00:00,86715,2383,158,48.68,False,Sunday,13,85,0.029302888773568587
Clément Mihailescu,What Type Of Programmer Are You?,2021-03-10 14:00:05+00:00,36899,1617,216,12.03,False,Wednesday,14,32,0.04967614298490474
Clément Mihailescu,Why Web Development Is Hard,2021-03-07 14:30:01+00:00,91924,5899,482,11.82,False,Sunday,14,27,0.06941603933684348
Clément Mihailescu,My First Software Engineering Job Interview,2021-02-20 14:30:09+00:00,40410,1731,147,14.82,False,Saturday,14,43,0.04647364513734224
Clément Mihailescu,7 Things They Don't Tell You About Entrepreneurship,2021-02-13 14:45:00+00:00,12995,660,111,11.9,False,Saturday,14,51,0.0593305117352828
Clément Mihailescu,Google Coding Interview Grading Rubric,2021-02-10 14:30:00+00:00,40874,1223,98,15.83,False,Wednesday,14,38,0.03231883348828106
Clément Mihailescu,Google Coding Interview With A Normal Software Engineer,2021-02-03 14:00:15+00:00,1750569,28229,2055,59.93,False,Wednesday,14,55,0.01729951804241935
Clément Mihailescu,"How We Grew AlgoExpert To Over 50,000 Customers",2021-01-27 14:30:00+00:00,15136,726,123,9.38,False,Wednesday,14,47,0.0560914376321353
Clément Mihailescu,Code Review Best Practices For Software Engineers,2021-01-25 14:00:01+00:00,112621,2895,147,15.45,False,Monday,14,49,0.027010948224576233
Clément Mihailescu,Why I Wear The Same All-Black Outfit Every Day,2021-01-21 14:00:30+00:00,42287,2053,378,12.4,False,Thursday,14,46,0.05748811691536406
Clément Mihailescu,My Ultra Minimalist Apartment,2021-01-15 14:30:04+00:00,263029,6308,1261,14.4,False,Friday,14,29,0.02877629462910934
Clément Mihailescu,How I Became A Millionaire At 25 (wealth-building tips),2021-01-09 14:30:07+00:00,66075,2801,414,14.38,False,Saturday,14,55,0.0486568293605751
Clément Mihailescu,What's It Like Being A Google Interviewer? (coding interview secrets),2021-01-06 15:45:00+00:00,43659,1639,184,24.68,False,Wednesday,15,69,0.04175542270780366
Clément Mihailescu,How To Communicate Better (as a software engineer),2021-01-02 17:00:30+00:00,32121,1432,103,17.93,False,Saturday,17,50,0.04778805143052831
Clément Mihailescu,My 4 Goals For 2021 - New Year's Resolutions,2020-12-27 14:30:01+00:00,17973,816,190,11.52,False,Sunday,14,44,0.05597284816113059
Clément Mihailescu,5 Reasons To Buy Bitcoin Ahead Of 2021,2020-12-19 16:00:29+00:00,25055,1033,225,27.45,False,Saturday,16,38,0.05020953901416883
Clément Mihailescu,Should You Get A Master's Degree / PhD In Computer Science? (for software engineering),2020-12-17 14:00:08+00:00,108905,3326,663,15.25,False,Thursday,14,86,0.036628253982829075
Clément Mihailescu,How Google Software Engineers Handle Outages (on call at Google),2020-12-14 16:30:01+00:00,61293,3155,421,17.98,False,Monday,16,64,0.058342714502471735
Clément Mihailescu,Why I Left New York And Moved To Las Vegas,2020-12-12 14:30:03+00:00,29877,1489,319,10.1,False,Saturday,14,42,0.06051477725340563
Clément Mihailescu,The Best Programming Language For Coding Interviews,2020-12-09 14:30:04+00:00,56774,2311,246,9.42,False,Wednesday,14,51,0.045038221721210414
Clément Mihailescu,How Much Do I Make From AlgoExpert? (250K Subscribers Q&A),2020-12-05 14:30:02+00:00,37732,1846,175,17.28,False,Saturday,14,58,0.053561963320258664
Clément Mihailescu,The Most Important Software Engineering Skill You've Never Heard Of,2020-11-30 14:30:08+00:00,25858,1483,233,9.3,False,Monday,14,67,0.06636244102405445
Clément Mihailescu,Why You WANT To Work At FAANG (my response to Web Dev Simplified),2020-11-25 14:30:03+00:00,80080,2829,435,31.2,False,Wednesday,14,65,0.04075924075924076
Clément Mihailescu,Easy Google Coding Interview With Ben Awad,2020-11-20 15:00:34+00:00,1038618,24827,772,28.0,False,Friday,15,42,0.024647175381131464
Clément Mihailescu,Software Engineer Expectations vs. Reality,2020-11-18 14:30:01+00:00,24487,1228,105,9.63,False,Wednesday,14,42,0.05443704822967289
Clément Mihailescu,AlgoExpert Just Hired 2 New Instructors!,2020-11-16 15:00:11+00:00,21341,1112,184,8.15,False,Monday,15,40,0.06072817581181763
Clément Mihailescu,Ex-Google Software Engineer Reacts To Posts On Blind,2020-11-07 14:30:04+00:00,34258,1288,159,14.4,False,Saturday,14,52,0.04223830930001751
Clément Mihailescu,Regretting Quitting My $350k Software Engineer Job At Facebook?,2020-11-04 14:30:05+00:00,49081,1785,223,10.33,False,Wednesday,14,63,0.04091196185896783
Clément Mihailescu,3 More Tips To Write Clean Code (from an ex-Facebook software engineer),2020-10-31 16:51:58+00:00,38310,1922,172,22.62,False,Saturday,16,71,0.05465935787000783
Clément Mihailescu,3 Tips To Write Clean Code (from an ex-Google software engineer),2020-10-24 13:30:00+00:00,200898,7606,522,17.2,False,Saturday,13,64,0.04045834204422145
Clément Mihailescu,Mock Coding Interviews On AlgoExpert?!,2020-10-22 15:45:02+00:00,15379,850,173,11.38,False,Thursday,15,38,0.06651927953703102
Clément Mihailescu,Software Engineering Project Contest WINNERS - Summer-Fall 2020,2020-10-18 14:30:02+00:00,16543,847,128,9.05,False,Sunday,14,63,0.05893731487638276
Clément Mihailescu,How To Get Promoted As A Software Engineer,2020-10-13 14:15:06+00:00,28039,1096,104,9.82,False,Tuesday,14,42,0.042797532008987484
Clément Mihailescu,5 Lessons I Learned In My Early 20s (as a 25 year old CEO),2020-10-08 13:30:03+00:00,25616,1542,172,11.98,False,Thursday,13,58,0.06691130543410369
Clément Mihailescu,Google Behavioral Interview With A Tech YouTuber,2020-10-03 14:00:06+00:00,122900,2707,275,35.02,False,Saturday,14,48,0.024263628966639545
Clément Mihailescu,Everything You Need To Know About Microsoft (for software engineers),2020-09-30 14:00:06+00:00,79976,2734,205,16.72,False,Wednesday,14,68,0.03674852455736721
Clément Mihailescu,The Truth About How I Learned to Code in 6 Months And Got Into Google,2020-09-25 13:30:02+00:00,68654,3728,325,14.73,False,Friday,13,69,0.059035161825967894
Clément Mihailescu,Chatting With A Competitive Programmer And Facebook Software Engineer,2020-09-22 13:30:00+00:00,98808,3278,186,24.12,False,Tuesday,13,69,0.03505789004938872
Clément Mihailescu,Google Coding Interview With A Facebook Software Engineer,2020-09-17 13:30:05+00:00,967500,14505,1233,49.98,False,Thursday,13,57,0.016266666666666665
Clément Mihailescu,What To Do If You're Stuck In A Coding Interview,2020-09-12 13:30:02+00:00,178046,11384,356,9.8,False,Saturday,13,48,0.06593801601833234
Clément Mihailescu,How To Land An Interview As A Software Engineer (tips and techniques),2020-09-07 13:30:05+00:00,36349,1848,157,14.62,False,Monday,13,69,0.05515970177996644
Clément Mihailescu,"USA vs. India - Software Engineering (Computer Science, College, Coding Bootcamp)",2020-08-31 13:30:08+00:00,255942,8636,785,22.22,False,Monday,13,81,0.036809120816434976
Clément Mihailescu,How Tech Companies Make Engineering And Product Decisions,2020-08-29 13:30:01+00:00,7249,450,86,12.15,False,Saturday,13,57,0.07394123327355498
Clément Mihailescu,I Just Became A Millionaire At 25 - How It Feels,2020-08-21 13:30:01+00:00,73005,3961,591,8.62,False,Friday,13,48,0.06235189370591055
Clément Mihailescu,Self-Taught Programmer vs Coding Bootcamp vs Computer Science Degree,2020-08-18 13:30:00+00:00,218426,10030,1113,17.33,False,Tuesday,13,68,0.05101498905807916
Clément Mihailescu,Reacting To Your Assumptions About Me (200K subscriber special),2020-08-15 13:30:00+00:00,18455,1166,192,11.25,False,Saturday,13,63,0.07358439447304253
Clément Mihailescu,Which Company Is Better For Software Engineers - Google or Facebook?,2020-08-12 13:30:03+00:00,47237,1689,216,18.75,False,Wednesday,13,68,0.040328556004826724
Clément Mihailescu,"Software Engineering Project CONTEST #2 - Win $1,000",2020-08-10 14:00:09+00:00,14835,735,116,5.6,False,Monday,14,52,0.05736434108527132
Clément Mihailescu,AlgoExpert.io | The Ultimate Software Engineering Interview Prep Platform,2020-08-05 16:00:30+00:00,1683566,2558,432,0.58,True,Wednesday,16,73,0.0017759921499959017
Clément Mihailescu,8 Lessons From Building A Multi Million Dollar Business,2020-08-03 13:30:01+00:00,16884,1164,120,13.57,False,Monday,13,55,0.07604832977967306
Clément Mihailescu,5 Software Engineering Best Practices You Should Follow,2020-07-25 13:30:08+00:00,47929,1734,126,11.43,False,Saturday,13,55,0.03880740261637005
Clément Mihailescu,How Much I Made In My First Year Of YouTube,2020-07-21 13:30:03+00:00,26009,1481,201,11.2,False,Tuesday,13,43,0.0646699219500942
Clément Mihailescu,What Do Software Engineers Do? (software development life cycle),2020-07-18 13:30:08+00:00,116501,4865,201,17.18,False,Saturday,13,64,0.04348460528235809
Clément Mihailescu,All You Need To Know About Behavioral Interviews (for software engineers),2020-07-15 13:30:00+00:00,190165,7040,230,15.25,False,Wednesday,13,73,0.038229958194199776
