channel_name,title,publishedAt,views,likes,comments,duration_min,is_short,weekday,hour,title_length,engagement
Data School,"Top AI news: ChatGPT undeletes your chats, Copilot security flaw, Veo 3 TV ad",2025-06-13 16:17:11+00:00,1692,35,3,2.65,False,Friday,16,77,0.022458628841607566
Data School,What is Retrieval Augmented Generation (RAG)?,2025-05-21 14:08:54+00:00,1002,38,1,2.98,False,Wednesday,14,45,0.038922155688622756
Data School,Jupyter & IPython terminology explained,2025-02-12 18:13:18+00:00,1749,95,9,4.98,False,Wednesday,18,39,0.05946255002858777
Data School,How to keep up with AI in 2025,2025-01-31 15:38:51+00:00,2163,104,3,2.95,False,Friday,15,30,0.04946833102172908
Data School,Build an AI chatbot with Python,2025-01-28 19:04:03+00:00,1667,57,9,5.67,False,Tuesday,19,31,0.03959208158368326
Data School,Guess the MYSTERY course 🎁,2024-09-17 14:43:22+00:00,982,34,66,0.43,True,Tuesday,14,26,0.10183299389002037
Data School,"Course outline: ""Master Machine Learning with scikit-learn""",2024-05-29 14:54:19+00:00,3737,71,13,4.8,False,Wednesday,14,59,0.02247792346802248
Data School,"Course overview: ""Master Machine Learning with scikit-learn""",2024-05-28 14:56:59+00:00,1503,29,6,1.9,False,Tuesday,14,60,0.023286759813705923
Data School,Introduction to model ensembling,2024-05-27 13:29:58+00:00,1017,22,3,1.67,False,Monday,13,32,0.024582104228121928
Data School,How to save a scikit-learn Pipeline with custom transformers,2024-05-26 18:34:16+00:00,1805,50,3,2.33,False,Sunday,18,60,0.029362880886426593
Data School,Should I shuffle samples with cross-validation?,2024-05-24 13:25:33+00:00,1272,32,5,3.87,False,Friday,13,47,0.02908805031446541
Data School,Cost-sensitive learning in scikit-learn,2024-05-23 14:06:08+00:00,1732,37,1,4.27,False,Thursday,14,39,0.021939953810623556
Data School,scikit-learn vs Deep Learning,2024-05-22 15:54:02+00:00,2015,56,9,1.83,False,Wednesday,15,29,0.03225806451612903
Data School,How to read the scikit-learn documentation,2024-04-22 18:06:31+00:00,6027,161,14,7.52,False,Monday,18,42,0.029036004645760744
Data School,My top 50 scikit-learn tips,2023-04-20 14:56:43+00:00,14263,512,49,167.52,False,Thursday,14,27,0.03933253873659118
Data School,21 more pandas tricks,2022-05-12 16:20:41+00:00,49708,1502,69,24.67,False,Thursday,16,21,0.03160457069284622
Data School,Adapt this pattern to solve many Machine Learning problems,2021-10-28 16:16:39+00:00,12771,447,16,7.82,False,Thursday,16,58,0.036254012998199046
Data School,Tune multiple models simultaneously with GridSearchCV,2021-10-26 13:53:24+00:00,7787,224,17,5.12,False,Tuesday,13,53,0.03094901759342494
Data School,Access part of a Pipeline using slicing,2021-10-21 14:49:56+00:00,2777,75,4,3.63,False,Thursday,14,39,0.02844796543032049
Data School,Tune the parameters of a VotingClassifer or VotingRegressor,2021-10-19 13:49:42+00:00,5239,176,11,4.12,False,Tuesday,13,59,0.03569383470127887
Data School,Ensemble multiple models using VotingClassifer or VotingRegressor,2021-10-14 11:40:31+00:00,11348,316,16,4.53,False,Thursday,11,65,0.029256256609094113
Data School,Create feature interactions using PolynomialFeatures,2021-10-12 15:26:05+00:00,7559,158,11,4.13,False,Tuesday,15,52,0.02235745468977378
Data School,Speed up GridSearchCV using parallel processing,2021-10-07 13:19:28+00:00,5285,127,7,2.27,False,Thursday,13,47,0.02535477767265847
Data School,Use OrdinalEncoder instead of OneHotEncoder with tree-based models,2021-10-05 16:25:13+00:00,4407,137,14,6.98,False,Tuesday,16,66,0.034263671431813025
Data School,Passthrough some columns and drop others in a ColumnTransformer,2021-09-30 15:29:47+00:00,4552,110,4,3.2,False,Thursday,15,63,0.025043936731107205
Data School,Drop the first category from binary features (only) with OneHotEncoder,2021-09-28 18:36:41+00:00,3202,96,9,4.12,False,Tuesday,18,70,0.03279200499687695
Data School,Estimators only print parameters that have been changed,2021-09-23 15:38:09+00:00,1960,59,3,1.6,False,Thursday,15,55,0.03163265306122449
Data School,Load a toy dataset into a DataFrame,2021-09-21 16:13:53+00:00,3294,78,6,2.18,False,Tuesday,16,35,0.025500910746812388
Data School,Get the feature names output by a ColumnTransformer,2021-09-16 15:28:08+00:00,8900,133,10,2.32,False,Thursday,15,51,0.016067415730337077
Data School,Create an interactive diagram of a Pipeline in Jupyter,2021-09-14 15:26:39+00:00,4988,161,7,2.13,False,Tuesday,15,54,0.03368083400160385
Data School,Most parameters should be passed as keyword arguments,2021-09-09 15:49:27+00:00,2895,75,11,1.93,False,Thursday,15,53,0.029706390328151987
Data School,Don't use .values when passing a pandas object to scikit-learn,2021-09-07 14:37:10+00:00,3163,118,3,1.38,False,Tuesday,14,62,0.03825482137211508
Data School,Add feature selection to a Pipeline,2021-09-02 10:28:15+00:00,8605,214,11,2.48,False,Thursday,10,35,0.026147588611272515
Data School,Use FunctionTransformer to convert functions into transformers,2021-08-31 11:48:09+00:00,7717,202,29,4.15,False,Tuesday,11,62,0.029933912142024104
Data School,Use AUC to evaluate multiclass problems,2021-08-26 10:57:09+00:00,9462,174,11,3.67,False,Thursday,10,39,0.019551891777636863
Data School,Shuffle your dataset when using cross_val_score,2021-08-24 14:40:47+00:00,7435,190,24,5.2,False,Tuesday,14,47,0.02878278412911903
Data School,Four ways to examine the steps of a Pipeline,2021-08-19 09:14:48+00:00,3137,86,3,2.03,False,Thursday,9,44,0.028371055148230795
Data School,Vectorize two text columns in a ColumnTransformer,2021-08-17 10:24:42+00:00,4099,77,9,1.95,False,Tuesday,10,49,0.02098072700658697
Data School,Save a model or Pipeline using joblib,2021-08-12 10:00:17+00:00,10256,183,13,1.75,False,Thursday,10,37,0.019110764430577222
Data School,Two ways to impute missing values for a categorical feature,2021-08-10 14:46:39+00:00,14315,223,13,2.63,False,Tuesday,14,59,0.016486203283269298
Data School,Use stratified sampling with train_test_split,2021-08-05 11:41:54+00:00,20752,454,23,4.43,False,Thursday,11,45,0.02298573631457209
Data School,Prune a decision tree to avoid overfitting,2021-08-03 12:08:14+00:00,5419,123,7,1.58,False,Tuesday,12,42,0.02398966599003506
Data School,Visualize a decision tree two different ways,2021-07-29 11:40:48+00:00,9251,183,34,3.9,False,Thursday,11,44,0.02345692357582964
Data School,Display the intercept and coefficients for a linear model,2021-07-27 12:31:21+00:00,5938,86,7,1.35,False,Tuesday,12,57,0.015661839003031322
Data School,Use the correct methods for each type of Pipeline,2021-07-22 13:05:27+00:00,3898,96,13,1.77,False,Thursday,13,49,0.027963057978450487
Data School,Compare multiple ROC curves in a single plot,2021-07-20 15:33:42+00:00,13287,181,31,1.87,False,Tuesday,15,44,0.015955445171972605
Data School,Plot a confusion matrix,2021-07-15 14:05:43+00:00,13371,185,24,3.07,False,Thursday,14,23,0.01563084286889537
Data School,Important tuning parameters for LogisticRegression,2021-07-13 14:11:41+00:00,17654,298,7,4.67,False,Tuesday,14,50,0.017276537895094597
Data School,Display GridSearchCV or RandomizedSearchCV results in a DataFrame,2021-07-08 13:48:27+00:00,5433,119,11,2.6,False,Thursday,13,65,0.023927848334253637
Data School,Try RandomizedSearchCV if GridSearchCV is taking too long,2021-07-06 13:24:01+00:00,9179,190,16,4.7,False,Tuesday,13,57,0.022442531866216364
Data School,Use cross_val_score and GridSearchCV on a Pipeline,2021-07-01 14:55:05+00:00,14107,393,40,7.03,False,Thursday,14,50,0.030693981711207203
Data School,Three reasons not to use drop='first' with OneHotEncoder,2021-06-29 13:56:55+00:00,5686,154,17,4.62,False,Tuesday,13,56,0.03007386563489272
Data School,HistGradientBoostingClassifier natively supports missing values,2021-06-24 10:14:58+00:00,4899,147,26,2.87,False,Thursday,10,63,0.035313329250867526
Data School,Examine the intermediate steps in a Pipeline,2021-06-22 09:49:57+00:00,4879,134,24,3.07,False,Tuesday,9,44,0.03238368518138963
Data School,What is the difference between Pipeline and make_pipeline?,2020-11-19 19:10:07+00:00,11490,289,24,2.92,False,Thursday,19,58,0.02724107919930374
Data School,Impute missing values using KNNImputer or IterativeImputer,2020-11-17 15:10:52+00:00,47279,1124,111,5.83,False,Tuesday,15,58,0.026121533873389877
Data School,"Set a ""random_state"" to make your code reproducible",2020-11-12 15:46:02+00:00,16044,367,28,2.6,False,Thursday,15,51,0.02461979556220394
Data School,"Add a missing indicator to encode ""missingness"" as a feature",2020-11-10 13:24:15+00:00,5975,160,15,3.03,False,Tuesday,13,60,0.029288702928870293
Data School,Use Pipeline to chain together multiple steps,2020-11-05 19:39:54+00:00,23141,469,29,3.2,False,Thursday,19,45,0.021520245451795515
Data School,Handle unknown categories with OneHotEncoder by encoding them as zeros,2020-11-03 11:27:15+00:00,8699,202,16,3.28,False,Tuesday,11,70,0.02506035176457064
Data School,Encode categorical features using OneHotEncoder or OrdinalEncoder,2020-10-29 15:15:46+00:00,36003,602,52,5.27,False,Thursday,15,65,0.01816515290392467
Data School,Four reasons to use scikit-learn (not pandas) for ML preprocessing,2020-10-27 14:19:54+00:00,13095,373,38,4.07,False,Tuesday,14,66,0.03138602520045819
Data School,"Use ""fit_transform"" on training data, but ""transform"" (only) on testing/new data",2020-10-22 15:06:18+00:00,19013,598,74,4.33,False,Thursday,15,80,0.035344238152842794
Data School,"What is the difference between ""fit"" and ""transform""?",2020-10-20 13:25:52+00:00,19783,411,16,2.73,False,Tuesday,13,53,0.02158418844462417
Data School,Seven ways to select columns using ColumnTransformer,2020-10-15 12:55:24+00:00,15718,354,34,4.12,False,Thursday,12,52,0.024685074436951265
Data School,Use ColumnTransformer to apply different preprocessing to different columns,2020-10-13 12:47:54+00:00,49069,985,94,3.4,False,Tuesday,12,75,0.02198944343679309
Data School,How do I merge DataFrames in pandas?,2020-02-24 13:39:52+00:00,160684,3434,294,21.82,False,Monday,13,36,0.02320081650942222
Data School,How do I encode categorical features using scikit-learn?,2019-11-12 15:36:09+00:00,141692,3987,454,27.98,False,Tuesday,15,56,0.03134263049431161
Data School,My top 25 pandas tricks,2019-07-11 12:53:28+00:00,276379,11023,656,27.63,False,Thursday,12,23,0.04225719030751251
Data School,Data Science Best Practices with pandas (PyCon 2019),2019-05-23 13:29:58+00:00,171446,4420,294,104.28,False,Thursday,13,52,0.027495537953641378
Data School,How do I stay up-to-date as a data scientist?,2018-11-16 17:00:00+00:00,15873,481,45,9.93,False,Friday,17,45,0.03313803313803314
Data School,How do I use the MultiIndex in pandas?,2018-11-15 16:58:17+00:00,180510,4298,316,25.02,False,Thursday,16,38,0.025560910752866876
Data School,Should I learn pandas before scikit-learn?,2018-11-14 17:00:00+00:00,16656,416,41,6.6,False,Wednesday,17,42,0.027437560038424593
Data School,How do I select features for Machine Learning?,2018-11-13 17:00:05+00:00,181645,5352,224,13.27,False,Tuesday,17,46,0.030697239120262048
Data School,Making sense of the confusion matrix,2018-10-31 14:58:29+00:00,123872,2150,148,35.42,False,Wednesday,14,36,0.018551407904934127
Data School,Q&A about Data School Insiders,2018-08-09 15:00:25+00:00,3174,50,27,42.58,False,Thursday,15,30,0.024259609325771897
Data School,Join Data School Insiders on Patreon!,2018-07-11 13:28:56+00:00,8247,119,17,1.48,False,Wednesday,13,37,0.016490845155814237
Data School,pandas best practices (10/10): Fixing bad data,2018-05-23 14:08:33+00:00,23115,521,70,16.53,False,Wednesday,14,46,0.02556781310837119
Data School,pandas best practices (9/10): Creating useful plots,2018-05-23 13:58:15+00:00,20086,259,20,8.8,False,Wednesday,13,51,0.013890271831126158
Data School,pandas best practices (8/10): Plotting a time series,2018-05-23 13:49:47+00:00,34074,302,20,8.82,False,Wednesday,13,52,0.009450020543522921
Data School,pandas best practices (7/10): Combining dates and times,2018-05-23 13:40:24+00:00,20548,249,21,9.2,False,Wednesday,13,55,0.01313996496009344
Data School,pandas best practices (6/10): Using string methods,2018-05-23 13:32:03+00:00,19187,212,12,5.93,False,Wednesday,13,50,0.011674571324334184
Data School,pandas best practices (5/10): Handling missing values,2018-05-23 13:22:41+00:00,20301,224,15,5.05,False,Wednesday,13,53,0.011772819072952072
Data School,pandas best practices (4/10): Examining relationships,2018-05-23 13:18:52+00:00,28816,370,19,8.75,False,Wednesday,13,53,0.013499444752915047
Data School,pandas best practices (3/10): Comparing groups,2018-05-23 13:11:59+00:00,32031,390,38,8.72,False,Wednesday,13,46,0.013362055508725922
Data School,pandas best practices (2/10): Removing columns,2018-05-23 13:04:20+00:00,28803,302,21,6.47,False,Wednesday,13,46,0.011214109641356803
Data School,pandas best practices (1/10): Introducing the dataset,2018-05-23 12:58:22+00:00,71051,883,76,19.68,False,Wednesday,12,53,0.013497346976115748
Data School,What's your favorite pandas trick??,2018-02-02 16:01:01+00:00,6405,163,127,1.62,False,Friday,16,35,0.04527712724434036
Data School,5 new changes in pandas you need to know about,2018-01-25 14:53:52+00:00,24900,669,64,20.92,False,Thursday,14,46,0.029437751004016063
Data School,4 new time-saving tricks in pandas,2018-01-25 14:44:27+00:00,47448,1214,84,14.85,False,Thursday,14,34,0.027356263699207555
Data School,Data School Live Stream,2017-08-25 18:44:52+00:00,0,0,0,0.0,True,Friday,18,23,
Data School,Web scraping in Python (Part 4): Exporting a CSV with pandas,2017-08-11 17:10:25+00:00,64969,1160,234,10.65,False,Friday,17,60,0.02145638689221013
Data School,Web scraping in Python (Part 3): Building a dataset,2017-08-11 16:42:40+00:00,69741,1257,135,11.52,False,Friday,16,51,0.01995956467501183
Data School,Web scraping in Python (Part 2): Parsing HTML with Beautiful Soup,2017-08-11 16:31:19+00:00,122019,1501,174,8.33,False,Friday,16,65,0.013727370327571936
Data School,Web scraping in Python (Part 1): Getting started,2017-08-11 16:20:26+00:00,123618,1816,231,9.27,False,Friday,16,48,0.016559077157048328
Data School,Write Pythonic Code for Better Data Science (webcast),2016-11-29 14:00:01+00:00,7682,97,44,119.98,False,Tuesday,14,53,0.018354595157511065
Data School,Machine Learning with Text in scikit-learn (PyData DC 2016),2016-11-10 15:53:34+00:00,20145,410,86,86.37,False,Thursday,15,59,0.024621494167287167
Data School,Your pandas questions answered! (webcast),2016-10-28 15:00:00+00:00,27052,379,112,116.03,False,Friday,15,41,0.018150229188230074
Data School,Q&A about Machine Learning with Text (online course),2016-09-15 13:42:28+00:00,9125,81,23,89.72,False,Thursday,13,52,0.011397260273972603
Data School,Getting started with machine learning in Python (webcast),2016-08-24 13:11:03+00:00,14466,139,30,119.98,False,Wednesday,13,57,0.011682566016867136
Data School,How do I apply a function to a pandas Series or DataFrame?,2016-08-23 13:00:02+00:00,204301,5028,483,17.97,False,Tuesday,13,58,0.02697490467496488
Data School,How do I create a pandas DataFrame from another object?,2016-08-16 13:00:00+00:00,43503,815,65,14.43,False,Tuesday,13,55,0.020228489989196147
Data School,How do I change display options in pandas?,2016-08-09 13:00:05+00:00,42756,935,66,14.93,False,Tuesday,13,42,0.02341191879502292
Data School,How do I avoid a SettingWithCopyWarning in pandas?,2016-08-02 13:00:01+00:00,45936,1641,216,13.5,False,Tuesday,13,50,0.04042580982236155
Data School,How do I find and remove duplicate rows in pandas?,2016-07-26 13:00:02+00:00,108871,2465,232,9.8,False,Tuesday,13,50,0.024772437104463082
Data School,How do I work with dates and times in pandas?,2016-07-19 13:00:03+00:00,188951,4118,439,10.35,False,Tuesday,13,45,0.024117363760975067
Data School,How do I create dummy variables in pandas?,2016-07-12 13:00:01+00:00,87135,2501,383,13.23,False,Tuesday,13,42,0.03309806621908533
Data School,More of your pandas questions answered!,2016-07-05 13:00:05+00:00,28665,607,71,19.4,False,Tuesday,13,39,0.023652537938252224
Data School,How do I use pandas with scikit-learn to create Kaggle submissions?,2016-06-28 14:33:31+00:00,45421,995,104,13.43,False,Tuesday,14,67,0.02419585654212809
Data School,How do I make my pandas DataFrame smaller and faster?,2016-06-21 14:41:30+00:00,67932,1961,246,19.1,False,Tuesday,14,53,0.03248837072366484
Data School,"When should I use the ""inplace"" parameter in pandas?",2016-06-14 11:27:15+00:00,55739,1525,123,10.32,False,Tuesday,11,52,0.029566371840183712
Data School,Machine Learning with Text in scikit-learn (PyCon 2016),2016-06-09 01:51:31+00:00,126553,1747,244,160.25,False,Thursday,1,55,0.015732538936255955
Data School,How do I select multiple rows and columns from a pandas DataFrame?,2016-06-07 14:39:42+00:00,354430,9823,815,21.78,False,Tuesday,14,66,0.030014389301131393
Data School,What do I need to know about the pandas index? (Part 2),2016-06-02 14:00:00+00:00,69559,1764,134,10.63,False,Thursday,14,55,0.02728618870311534
Data School,What do I need to know about the pandas index? (Part 1),2016-05-31 17:51:26+00:00,135953,2949,248,13.62,False,Tuesday,17,55,0.023515479614278464
Data School,How do I handle missing values in pandas?,2016-05-26 13:42:17+00:00,199586,4467,378,14.47,False,Thursday,13,41,0.024275249767017726
Data School,How do I explore a pandas Series?,2016-05-24 14:53:38+00:00,76624,1793,129,9.85,False,Tuesday,14,33,0.02508352474420547
Data School,"When should I use a ""groupby"" in pandas?",2016-05-19 13:13:57+00:00,248713,6074,634,8.42,False,Thursday,13,40,0.026970845914769233
Data School,How do I change the data type of a pandas Series?,2016-05-17 13:34:09+00:00,135356,2312,316,7.48,False,Tuesday,13,49,0.019415467360146578
Data School,How do I use string methods in pandas?,2016-05-12 12:01:46+00:00,88961,1748,209,6.28,False,Thursday,12,38,0.02199840379492137
Data School,"How do I use the ""axis"" parameter in pandas?",2016-05-10 15:08:27+00:00,84407,1966,233,8.57,False,Tuesday,15,44,0.026052341630433493
Data School,Your pandas questions answered!,2016-05-05 13:05:05+00:00,70909,1366,122,9.12,False,Thursday,13,31,0.020984642288002932
Data School,How do I apply multiple filter criteria to a pandas DataFrame?,2016-05-03 13:08:05+00:00,192762,3902,476,9.87,False,Tuesday,13,62,0.02271194530042228
Data School,How do I filter rows of a pandas DataFrame by column value?,2016-04-28 14:27:23+00:00,282421,5558,745,13.75,False,Thursday,14,59,0.022317745493430022
Data School,How do I sort a pandas DataFrame or a Series?,2016-04-26 12:25:05+00:00,119690,2228,197,8.95,False,Tuesday,12,45,0.02026067340629961
Data School,How do I remove columns from a pandas DataFrame?,2016-04-21 12:58:36+00:00,140022,2366,255,6.6,False,Thursday,12,48,0.01871848709488509
Data School,How do I rename columns in a pandas DataFrame?,2016-04-19 12:15:28+00:00,154096,3090,328,9.62,False,Tuesday,12,46,0.022180978091579276
Data School,Why do some pandas commands end with parentheses (and others don't)?,2016-04-14 12:45:35+00:00,116548,2617,227,8.77,False,Thursday,12,68,0.024401963139650616
Data School,How do I select a pandas Series from a DataFrame?,2016-04-12 12:28:20+00:00,162821,3177,363,11.18,False,Tuesday,12,49,0.02174166722965711
Data School,How do I read a tabular data file into pandas?,2016-04-07 13:18:20+00:00,215077,3388,485,8.92,False,Thursday,13,46,0.018007504289161556
Data School,What is pandas? (Introduction to the Q&A series),2016-04-07 12:37:47+00:00,441716,3869,317,6.42,False,Thursday,12,48,0.00947667732208025
Data School,How to evaluate a classifier in scikit-learn,2015-10-23 10:56:18+00:00,153993,2379,409,54.78,False,Friday,10,44,0.018104719045670906
Data School,How to find the best model parameters in scikit-learn,2015-07-16 05:02:51+00:00,155409,2468,343,27.77,False,Thursday,5,53,0.018087755535393702
Data School,Selecting the best model in scikit-learn using cross-validation,2015-06-28 17:14:34+00:00,214520,3426,595,35.9,False,Sunday,17,63,0.018744173037479023
Data School,"Data science in Python: pandas, seaborn, scikit-learn",2015-05-28 15:30:45+00:00,188164,2489,572,34.5,False,Thursday,15,53,0.016267723900427286
Data School,Comparing machine learning models in scikit-learn,2015-05-14 14:10:39+00:00,188504,3184,596,26.7,False,Thursday,14,49,0.020052624877986674
Data School,Training a machine learning model with scikit-learn,2015-04-29 18:39:54+00:00,226388,2857,547,19.82,False,Wednesday,18,51,0.01503613265720798
Data School,Getting started in scikit-learn with the famous iris dataset,2015-04-21 21:34:35+00:00,256076,2926,308,15.43,False,Tuesday,21,60,0.012629063246848591
Data School,Setting up Python for machine learning: scikit-learn and Jupyter Notebook,2015-04-15 16:16:33+00:00,254322,2264,195,14.63,False,Wednesday,16,73,0.009668845007510165
Data School,"What is machine learning, and how does it work?",2015-04-08 04:38:32+00:00,490331,4712,457,10.35,False,Wednesday,4,47,0.010541858458877779
Data School,Going deeper with dplyr: New features in 0.3 and 0.4 (tutorial),2015-03-09 03:31:31+00:00,39994,608,93,36.9,False,Monday,3,63,0.017527629144371656
Data School,ROC Curves and Area Under the Curve (AUC) Explained,2014-11-20 03:20:44+00:00,501719,6494,638,14.1,False,Thursday,3,51,0.014215128388599993
Data School,Hands-on dplyr tutorial for faster data manipulation in R,2014-08-23 03:41:39+00:00,336694,4279,363,38.95,False,Saturday,3,57,0.01378699947133005
Data School,Troubleshooting: Updates Rejected When Pushing to GitHub,2014-08-16 19:34:01+00:00,83444,961,252,8.95,False,Saturday,19,56,0.014536695268683189
Data School,Allstate Purchase Prediction Challenge on Kaggle,2014-05-22 23:29:02+00:00,22243,221,20,16.28,False,Thursday,23,48,0.010834869397113698
Data School,Additional Resources for Learning Git and GitHub,2014-05-03 21:56:37+00:00,19677,127,10,1.52,False,Saturday,21,48,0.006962443461909844
Data School,Syncing Your GitHub Fork,2014-05-03 21:54:10+00:00,110920,1159,105,4.45,False,Saturday,21,24,0.01139560043274432
Data School,Committing Changes in Git and Pushing to a GitHub Repository,2014-05-03 20:00:30+00:00,395318,2866,304,5.53,False,Saturday,20,60,0.008018860765257338
Data School,Copying a GitHub Repository to Your Local Computer,2014-05-02 06:04:13+00:00,536322,2443,197,4.15,False,Friday,6,50,0.004922416011276807
Data School,Creating a New GitHub Repository,2014-05-02 05:49:33+00:00,110850,267,10,1.08,False,Friday,5,32,0.002498872350022553
Data School,Forking a GitHub Repository,2014-05-02 05:35:13+00:00,153695,836,47,2.5,False,Friday,5,27,0.005745144604573994
Data School,Navigating a GitHub Repository - Part 2,2014-04-30 19:13:08+00:00,44940,168,9,2.47,False,Wednesday,19,39,0.003938584779706275
Data School,Navigating a GitHub Repository - Part 1,2014-04-30 19:11:00+00:00,73382,259,7,2.32,False,Wednesday,19,39,0.0036248671336295006
Data School,Setting up Git and GitHub,2014-04-30 19:09:12+00:00,72591,173,11,1.25,False,Wednesday,19,25,0.0025347494868509872
Data School,What is the difference between Git and GitHub?,2014-04-30 19:06:24+00:00,136111,752,43,1.93,False,Wednesday,19,46,0.005840821094547833
