channel_name,title,publishedAt,views,likes,comments,duration_min,is_short,weekday,hour,title_length,engagement
take U forward,Major Announcement | TUF+ V2 and System Design Playlist 🔥,2025-01-26 04:59:19+00:00,119745,4217,291,19.2,False,Sunday,4,57,0.03764666583155873
take U forward,Launching the best DSA Course + Platform,2024-08-07 12:39:14+00:00,262951,8365,1433,36.48,False,Wednesday,12,40,0.03726169514472278
take U forward,L18. Implement LRU Cache,2024-07-16 17:27:12+00:00,164122,3788,154,24.93,False,Tuesday,17,24,0.024018717783112563
take U forward,L17. The Celebrity Problem | Stack and Queue Playlist,2024-07-16 17:26:12+00:00,78059,2677,110,16.28,False,Tuesday,17,53,0.0357037625385926
take U forward,L16. Sliding Window Maximum | Stack and Queue Playlist,2024-07-16 17:23:43+00:00,106776,2947,98,19.97,False,Tuesday,17,54,0.028517644414475164
take U forward,L15. Stock Span Problem | Stack and Queue Playlist,2024-07-16 17:21:56+00:00,75277,2104,49,19.35,False,Tuesday,17,50,0.028601033516213452
take U forward,L14. Remove K Digits | Stack and Queue Playlist,2024-07-16 17:18:29+00:00,76630,2654,87,15.48,False,Tuesday,17,47,0.03576928096045935
take U forward,L13. Maximal Rectangle | Stack and Queue Playlist,2024-07-16 17:16:37+00:00,61744,2387,72,12.2,False,Tuesday,17,49,0.03982573205493651
take U forward,L12. Largest Rectangle in Histogram | Stack and Queue Playlist,2024-07-16 17:15:27+00:00,139431,3908,166,31.7,False,Tuesday,17,62,0.029218753361877917
take U forward,L11. Aestroid Collisions | Stack and Queue Playlist,2024-07-16 17:14:25+00:00,81897,2875,115,17.47,False,Tuesday,17,51,0.036509273843974746
take U forward,L10. Sum of subarray ranges | Stack and Queue Playlist,2024-07-16 17:11:21+00:00,81316,2602,83,10.57,False,Tuesday,17,54,0.0330193319887845
take U forward,L9. Sum of Subarray Minimum | Stack and Queue Playlist,2024-07-16 17:10:18+00:00,174191,4025,302,23.58,False,Tuesday,17,54,0.0248405485932109
take U forward,L8. Trapping Rainwater | 2 Approaches | Stack and Queue Playlist,2024-07-16 17:08:47+00:00,189332,4605,255,28.97,False,Tuesday,17,64,0.025669194853484883
take U forward,L7. Previous Smaller Element | Stack and Queue Playlist,2024-07-16 17:04:12+00:00,56313,2001,32,8.18,False,Tuesday,17,55,0.036101788219416474
take U forward,L6. Next Greater Element - II | Stack and Queue Playlist,2024-07-16 17:02:30+00:00,120576,3920,133,15.68,False,Tuesday,17,56,0.03361365445859873
take U forward,L5. Next Greater Element | Stack and Queue Playlist,2024-07-16 17:00:35+00:00,184308,5533,89,18.42,False,Tuesday,17,51,0.030503287974477506
take U forward,L4. Implement Min Stack | Stack and Queue Playlist,2024-07-16 16:59:41+00:00,131235,3982,127,20.92,False,Tuesday,16,50,0.03131024498037871
take U forward,L2. Check for Balanced Parentheses | Stack and Queue,2024-07-16 16:54:08+00:00,120360,3768,54,12.47,False,Tuesday,16,52,0.031754735792622134
take U forward,"L3. Prefix, Infix, and Postfix Conversion | Stack and Queue Playlist",2024-07-16 16:49:30+00:00,253797,5308,199,50.78,False,Tuesday,16,68,0.021698444032041356
take U forward,L1. Introduction to Stack and Queue | Implementation using Data Structures,2024-07-16 16:47:38+00:00,500213,7882,270,65.1,False,Tuesday,16,74,0.016297057453524798
take U forward,L13. Fractional Knapsack Algorithm,2024-05-27 04:55:19+00:00,108336,3184,131,18.68,False,Monday,4,34,0.03059924678777138
take U forward,L12. Candy | Slope Approach Intuition Based,2024-05-27 04:53:42+00:00,85175,2968,129,30.17,False,Monday,4,43,0.03636043439976519
take U forward,L11. Valid Parenthesis String | Multiple Approaches,2024-05-27 04:50:28+00:00,113931,3315,124,26.15,False,Monday,4,51,0.030184936496651483
take U forward,L10. Minimum number of platforms required in a railway station,2024-05-27 04:48:13+00:00,92269,3357,178,18.17,False,Monday,4,62,0.03831189240156499
take U forward,L9. Insert Intervals | Greedy Algorithms Playlist,2024-05-27 04:45:40+00:00,72253,2603,69,13.27,False,Monday,4,49,0.03698116341189985
take U forward,L8. Non Overlapping Intervals | Greedy Algorithms Playlist,2024-05-27 04:44:02+00:00,69788,2462,58,8.77,False,Monday,4,58,0.03610935977531954
take U forward,L7. N Meeting in One Room | Greedy Algorithms Playlist,2024-05-27 04:36:58+00:00,103274,3094,82,13.2,False,Monday,4,54,0.030753142126769564
take U forward,L6. Job Sequencing Problem | Greedy Algorithm Playlist,2024-05-27 04:34:06+00:00,124206,3400,127,16.12,False,Monday,4,54,0.028396373766162664
take U forward,L5. Jump Game - II | Greedy Algorithm Playlist,2024-05-22 02:50:38+00:00,148842,4419,174,16.75,False,Wednesday,2,46,0.03085822550086669
take U forward,L4. Jump Game - I | Greedy Algorithm Playlist,2024-05-22 02:48:45+00:00,143248,4572,116,10.88,False,Wednesday,2,45,0.032726460404333746
take U forward,L3. Shortest Job First (or SJF) CPU Scheduling,2024-05-22 02:47:12+00:00,82578,2821,81,7.33,False,Wednesday,2,46,0.03514253190922522
take U forward,L2. Lemonade Change | Greedy Algorithm Playlist,2024-05-22 02:44:55+00:00,91177,3586,89,9.0,False,Wednesday,2,47,0.04030621757680117
take U forward,L1. Assign Cookies | Greedy Algorithm Playlist,2024-05-22 02:42:43+00:00,256607,6199,162,10.85,False,Wednesday,2,46,0.0247888794927652
take U forward,L12. Minimum Window Substring | 2 Pointers and Sliding Window Playlist,2024-03-27 04:25:00+00:00,174008,4451,318,27.1,False,Wednesday,4,70,0.027406785894901385
take U forward,L11. Subarray with k different integers | 2 Pointers and Sliding Window Playlist,2024-03-27 04:20:00+00:00,103150,3541,144,20.82,False,Wednesday,4,80,0.03572467280659234
take U forward,L10. Count number of Nice subarrays | 2 Pointers and Sliding Window Playlist,2024-03-27 04:15:01+00:00,122058,3674,80,4.9,False,Wednesday,4,76,0.030755870160087826
take U forward,L9. Binary Subarrays With Sum | 2 Pointers and Sliding Window Playlist,2024-03-27 04:10:00+00:00,186152,4994,201,20.45,False,Wednesday,4,70,0.02790730156001547
take U forward,L8. Longest Repeating Character Replacement | 2 Pointers and Sliding Window Playlist,2024-03-27 04:05:00+00:00,214233,5760,199,25.35,False,Wednesday,4,84,0.027815509281950028
take U forward,L7. Number of Substrings Containing All Three Characters | 2 Pointers and Sliding Window Playlist,2024-03-27 04:00:28+00:00,148766,4891,176,19.67,False,Wednesday,4,97,0.034060201927859864
take U forward,L6. Longest Substring With At Most K Distinct Characters | 2 Pointers and Sliding Window Playlist,2024-03-27 03:55:00+00:00,130458,3716,173,21.53,False,Wednesday,3,97,0.02981036042251146
take U forward,L5. Fruit Into Baskets | 2 Pointers and Sliding Window Playlist,2024-03-27 03:50:00+00:00,161889,5008,193,30.03,False,Wednesday,3,63,0.03212695118260042
take U forward,L4. Max Consecutive Ones III | 2 Pointers and Sliding Window Playlist,2024-03-27 03:45:00+00:00,209615,6149,206,29.97,False,Wednesday,3,69,0.030317486821076736
take U forward,L3. Longest Substring Without Repeating Characters | 2 Pointers and Sliding Window Playlist,2024-03-27 03:40:00+00:00,365782,8551,228,23.15,False,Wednesday,3,91,0.02400063425756325
take U forward,L2. Maximum Points You Can Obtain from Cards | 2 Pointers and Sliding Window Playlist,2024-03-27 03:35:00+00:00,199231,7301,185,11.22,False,Wednesday,3,85,0.03757447385196079
take U forward,L1. Introduction to Sliding Window and 2 Pointers | Templates | Patterns,2024-03-27 03:30:05+00:00,514742,12322,330,36.92,False,Wednesday,3,72,0.024579303806567174
take U forward,L8. Smallest Prime Factor (SPF) | Prime Factorisation | Query Based Problem | Maths Playlist,2024-03-17 18:00:09+00:00,49084,1611,54,16.95,False,Sunday,18,92,0.033921440795371204
take U forward,L7. Count Prime in a range L-R | Maths Playlist,2024-03-17 17:55:19+00:00,29194,972,27,16.65,False,Sunday,17,47,0.034219360142495034
take U forward,L6. Sieve of Eratosthenes | Maths Playlist,2024-03-17 17:53:12+00:00,121555,3746,98,18.45,False,Sunday,17,42,0.03162354489737156
take U forward,L5. Power Exponentiation | Maths Playlist,2024-03-17 17:48:40+00:00,71992,2302,85,12.65,False,Sunday,17,41,0.03315646182909212
take U forward,L4. Print all prime factors of a Number | Maths Playlist,2024-03-17 17:46:04+00:00,95007,2641,95,18.88,False,Sunday,17,56,0.02879787805109097
take U forward,L3. Check if a Number if Prime or not | Maths Playlist,2024-03-17 17:43:49+00:00,79615,1695,41,7.17,False,Sunday,17,54,0.021804936255730704
take U forward,L2. Print all Divisors of a Number | Maths Playlist,2024-03-17 17:40:44+00:00,76302,2116,74,9.17,False,Sunday,17,51,0.028701737831249508
take U forward,L9. Divide Two Integers without using Multiplication and Division Operators | Bit Manipulation,2024-03-09 09:06:08+00:00,153203,4247,207,19.2,False,Saturday,9,94,0.029072537744038954
take U forward,L8. XOR of Numbers in a Given Range | Bit Manipulation,2024-03-09 09:03:59+00:00,86149,3683,90,9.63,False,Saturday,9,54,0.04379621353701146
take U forward,L7. Single Number III | Bit Manipulation,2024-03-09 09:02:04+00:00,103023,3460,96,24.05,False,Saturday,9,40,0.034516564262349184
take U forward,L6. Single Number II | Bit Manipulation,2024-03-09 08:59:53+00:00,98747,3369,154,31.32,False,Saturday,8,39,0.035677033226325865
take U forward,L5. Single Number-I | Bit Manipulation,2024-03-09 08:58:16+00:00,78278,2902,51,7.2,False,Saturday,8,38,0.03772452029944556
take U forward,L4. Power Set | Bit Manipulation,2024-03-09 08:56:12+00:00,132078,4203,92,12.63,False,Saturday,8,32,0.03251866321416133
take U forward,L3. Minimum Bit Flips to Convert Number | Bit Manipulation,2024-03-09 08:45:24+00:00,114772,3677,84,7.0,False,Saturday,8,58,0.03276931655804552
take U forward,L2. Must Know Tricks in Bit Manipulation | Swap two numbers without third variable,2024-03-09 08:41:08+00:00,300523,7492,223,41.75,False,Saturday,8,82,0.025671911966804538
take U forward,L1. Introduction to Bit Manipulation | 1's 2's Compliment | Bit Operators,2024-03-09 05:59:33+00:00,386486,9912,326,39.05,False,Saturday,5,73,0.02648996341393996
take U forward,Don't watch my A2Z DSA Course,2024-03-01 06:05:07+00:00,1661257,23601,718,8.4,False,Friday,6,29,0.014638914990275436
take U forward,L28. Design a Browser History | LinkedList Implementation,2024-01-01 06:06:03+00:00,68236,1817,124,14.63,False,Monday,6,57,0.028445395392461457
take U forward,L27. Clone a LinkedList with Next and Random Pointers | Copy List with Random Pointers,2024-01-01 06:05:59+00:00,120679,3907,135,33.0,False,Monday,6,86,0.03349381416816513
take U forward,L26. Sort a Linked List | Merge Sort and Brute Force,2024-01-01 06:05:54+00:00,186700,4952,156,22.18,False,Monday,6,52,0.02735940010712373
take U forward,L24. Flattening a LinkedList | Multiple Approaches with Dry Run,2024-01-01 06:05:48+00:00,111438,3713,175,32.97,False,Monday,6,63,0.03488935551607172
take U forward,L25. Merge K Sorted Lists | Multiple Approaches,2024-01-01 06:03:17+00:00,89285,2615,91,30.03,False,Monday,6,47,0.030307442459539678
take U forward,L23. Merge two sorted Linked Lists,2024-01-01 06:02:21+00:00,118126,3757,114,18.92,False,Monday,6,34,0.03277009295159406
take U forward,L22. Rotate a LinkedList,2023-11-30 07:40:53+00:00,115562,3837,165,12.17,False,Thursday,7,24,0.03463076097679168
take U forward,L21. Reverse Nodes in K Group Size of LinkedList,2023-11-30 07:38:36+00:00,173499,4866,175,24.52,False,Thursday,7,48,0.029054922506757962
take U forward,L20. Remove duplicates from sorted DLL,2023-11-30 07:36:05+00:00,72185,2837,94,12.88,False,Thursday,7,38,0.04060400360185634
take U forward,L19. Find all Pairs with given Sum in DLL,2023-11-30 07:34:11+00:00,75657,3306,129,14.23,False,Thursday,7,41,0.04540227606169951
take U forward,L18. Delete all occurrences of a Key in DLL,2023-11-30 07:32:14+00:00,86583,3305,101,11.22,False,Thursday,7,43,0.03933797627709828
take U forward,L17. Find the starting point of the Loop/Cycle in LinkedList | Multiple Approaches,2023-11-29 15:25:02+00:00,135519,6303,298,22.7,False,Wednesday,15,82,0.04870903710918764
take U forward,L16. Delete the middle node of the LinkedList,2023-11-29 14:33:19+00:00,78847,3167,115,16.6,False,Wednesday,14,45,0.04162491914720915
take U forward,L15. Find the length of the Loop in LinkedList,2023-11-29 14:03:34+00:00,101969,3772,121,14.02,False,Wednesday,14,46,0.038178269866331924
take U forward,L14. Detect a loop or cycle in LinkedList | With proof and Intuition,2023-11-29 13:57:24+00:00,175022,6931,208,20.43,False,Wednesday,13,68,0.0407891579344311
take U forward,L13. Find the middle element of the LinkedList | Multiple Approaches,2023-11-29 13:54:34+00:00,125806,4452,93,14.62,False,Wednesday,13,68,0.03612705276377915
take U forward,L12. Find the intersection point of Y LinkedList,2023-11-29 13:25:42+00:00,139209,5006,228,32.08,False,Wednesday,13,48,0.03759814379817397
take U forward,L11. Add 1 to a number represented by LinkedList,2023-11-29 13:23:53+00:00,129350,4385,148,25.47,False,Wednesday,13,48,0.03504445303440278
take U forward,L10. Check if a LinkedList is Palindrome or Not | Multiple Approaches,2023-11-26 17:23:23+00:00,175166,5802,202,20.03,False,Sunday,17,69,0.03427605813913659
take U forward,L9. Reverse a LinkedList | Iterative and Recursive,2023-11-26 17:19:50+00:00,274840,7655,256,32.7,False,Sunday,17,50,0.028784019793334302
take U forward,L8. Remove Nth Node from the end of the LinkedList | Multiple Approaches,2023-11-26 17:05:01+00:00,153795,7454,301,16.38,False,Sunday,17,72,0.05042426606846777
take U forward,"L7. Sort a LinkedList of 0's, 1's and 2's | Multiple Approaches",2023-11-26 16:36:53+00:00,134405,4771,201,23.38,False,Sunday,16,63,0.036992671403593615
take U forward,L6. Odd Even Linked List | Multiple Approaches,2023-11-26 16:34:53+00:00,175876,6359,362,24.08,False,Sunday,16,46,0.03821442379858537
take U forward,L5. Add 2 numbers in LinkedList | Dummy Node Approach,2023-11-26 16:27:02+00:00,196764,7480,190,14.8,False,Sunday,16,53,0.038980707853062554
take U forward,L4. Reverse a DLL | Multiple Approaches,2023-11-26 15:00:30+00:00,165413,5996,128,18.5,False,Sunday,15,39,0.0370224831180137
take U forward,L3. Introduction to Doubly LinkedList | Insertions and Deletions,2023-11-26 06:36:42+00:00,313525,8221,263,64.12,False,Sunday,6,64,0.027060043058767243
take U forward,L2. Deletion and Insertion in LL | 8 Problems,2023-11-26 06:25:13+00:00,424266,11576,323,56.5,False,Sunday,6,45,0.028046084296172683
take U forward,L1. Introduction to LinkedList | Traversal | Length | Search an Element,2023-11-26 01:30:10+00:00,721322,19920,463,45.28,False,Sunday,1,71,0.028257837692459122
take U forward,Paid LinkedList Bootcamp - Launch Video,2023-11-25 03:30:11+00:00,413489,17253,2410,9.68,False,Saturday,3,39,0.047553864794468534
take U forward,System Design Roadmap. Special thanks to @gkcs for helping with this one ♥️,2023-10-13 09:09:26+00:00,158564,14528,86,0.98,True,Friday,9,75,0.09216467798491461
take U forward,What caused facebook to go down?,2023-10-06 09:58:14+00:00,41188,2648,14,0.97,True,Friday,9,32,0.06463047489560066
take U forward,How to setup VS code for DSA and CP | Input / Output split format,2023-09-27 07:04:35+00:00,946035,11121,899,8.85,False,Wednesday,7,65,0.012705660995629127
take U forward,TODO: Add this chrome extension for your internship and placement season,2023-09-15 08:01:18+00:00,304161,35570,73,0.78,True,Friday,8,72,0.11718464891948673
take U forward,BS-27. Median in a Row Wise Sorted Matrix,2023-09-13 06:55:15+00:00,162035,4756,266,23.22,False,Wednesday,6,41,0.030993303915820655
take U forward,BS-26. Find Peak Element-II | Binary Search,2023-09-12 07:09:31+00:00,150442,5010,192,20.03,False,Tuesday,7,43,0.03457810983634889
take U forward,Crack high paying MAANG jobs with Newton Edge,2023-09-08 08:35:11+00:00,42979,1596,17,1.02,False,Friday,8,45,0.037529956490379025
take U forward,BS-25. Search in a 2D Matrix - II  |  Binary Search on 2D,2023-08-13 08:52:20+00:00,130195,5470,200,15.48,False,Sunday,8,57,0.043550059526095475
take U forward,BS-24. Search in a 2D Matrix - I | Binary Search of 2D,2023-08-13 08:31:15+00:00,186923,5852,190,15.7,False,Sunday,8,54,0.032323470091963
take U forward,BS 23. Row with maximum number of 1s | Binary Search on 2D Arrays,2023-08-13 08:30:59+00:00,119423,4092,152,10.3,False,Sunday,8,65,0.03553754301935138
take U forward,Bs-22. K-th element of two sorted arrays | Binary Search Approach,2023-08-13 08:30:45+00:00,142716,3798,160,11.88,False,Sunday,8,65,0.027733400599792596
take U forward,BS 21: Median of two Sorted Arrays of Different Sizes | Brute and Better Approach,2023-08-13 08:30:32+00:00,250658,5100,121,15.98,False,Sunday,8,81,0.02082917760454484
take U forward,BS-21. Median of two Sorted Arrays of Different Sizes | Binary Search Approach With Intuition,2023-08-13 08:30:28+00:00,327727,11662,547,35.0,False,Sunday,8,93,0.03725356775608967
take U forward,BS-20. Minimise Maximum Distance between Gas Stations | 3 Approaches | Heap | Binary Search,2023-07-16 17:18:43+00:00,227218,6987,437,59.2,False,Sunday,17,91,0.032673467771039265
take U forward,BS 19. Painter's Partition and Split Array - Largest Sum,2023-07-12 13:59:15+00:00,178623,5145,180,11.33,False,Wednesday,13,56,0.029811390470432138
take U forward,Update on A2Z DSA course!,2023-07-05 02:37:01+00:00,166721,11255,131,0.67,True,Wednesday,2,25,0.0682937362419851
take U forward,BS-18. Allocate Books or Book Allocation | Hard Binary Search,2023-06-27 07:33:43+00:00,274506,7809,420,27.48,False,Tuesday,7,61,0.029977486830888942
take U forward,BS-17. Aggressive Cows | Binary Search Hard,2023-06-27 07:33:40+00:00,270019,8768,350,26.73,False,Tuesday,7,43,0.0337679941041186
take U forward,BS-16. Kth Missing Positive Number | Maths + Binary Search,2023-06-23 13:16:02+00:00,249648,8138,465,22.87,False,Friday,13,58,0.03446052041274114
take U forward,BS-15. Capacity to Ship Packages within D Days,2023-06-23 13:13:10+00:00,167689,6094,251,20.6,False,Friday,13,46,0.037837902307247345
take U forward,BS-14. Find the Smallest Divisor Given a Threshold | Binary Search,2023-06-22 13:24:46+00:00,138778,5647,237,16.0,False,Thursday,13,66,0.04239865108302469
take U forward,BS-13. Minimum days to make M bouquets | Binary Search,2023-06-22 13:24:42+00:00,234668,7616,321,26.02,False,Thursday,13,54,0.033822251009937444
take U forward,BS-12. Koko Eating Bananas,2023-06-21 10:28:30+00:00,292958,8792,355,21.07,False,Wednesday,10,26,0.031222905672485476
take U forward,BS-11. Find the Nth root of an Integer,2023-06-21 10:25:48+00:00,195870,7200,303,20.73,False,Wednesday,10,38,0.03830601929851432
take U forward,BS-10. Finding Sqrt of a number using Binary Search,2023-06-20 05:49:27+00:00,220281,8048,313,17.18,False,Tuesday,5,51,0.037956065207621174
take U forward,BS-9. Find Peak Element,2023-06-20 05:41:33+00:00,305261,10709,570,32.88,False,Tuesday,5,23,0.03694870946501518
take U forward,Striver's SDE SHEET CHALLENGE 2023 | 2.25L Worth Prizes | Sheet for Interviews,2023-06-04 03:30:21+00:00,99468,3871,245,6.7,False,Sunday,3,78,0.041380142357341054
take U forward,BS-8. Single Element in Sorted Array,2023-06-01 19:32:12+00:00,264182,8589,449,22.27,False,Thursday,19,36,0.034211263447168995
take U forward,BS-7. Find out how many times array has been rotated,2023-06-01 19:32:03+00:00,186665,6669,210,5.02,False,Thursday,19,52,0.03685211475102456
take U forward,BS-6. Minimum in Rotated Sorted Array,2023-06-01 19:32:00+00:00,296182,11410,522,17.13,False,Thursday,19,37,0.040286040340061176
take U forward,BS-5. Search Element in Rotated Sorted Array II,2023-06-01 19:31:57+00:00,291648,11842,486,12.73,False,Thursday,19,47,0.04227013385999561
take U forward,BS-4. Search Element in Rotated Sorted Array - I,2023-06-01 19:31:51+00:00,440942,13279,613,16.63,False,Thursday,19,48,0.031505277338062604
take U forward,BS-3. First and Last Occurrences in Array | Count occurrences in Array,2023-06-01 19:31:48+00:00,359480,9610,461,25.47,False,Thursday,19,70,0.028015466785356626
take U forward,BS-2. Implement Lower Bound and Upper Bound | Search Insert Position | Floor and Ceil,2023-06-01 19:31:41+00:00,516001,13257,583,32.43,False,Thursday,19,85,0.02682165344640805
take U forward,BS-1. Binary Search Introduction | Real Life Example | Iterative | Recursive | Overflow Cases,2023-06-01 19:31:37+00:00,444748,13792,388,33.45,False,Thursday,19,93,0.031883223758173165
take U forward,"Launching Binary Search Bootcamp - C++, Java, Python, Notes, Contest, Doubt Support 🔥",2023-05-17 06:13:51+00:00,352223,11327,1830,12.9,False,Wednesday,6,85,0.0373541761895163
take U forward,Maximum Product Subarray - Best Intuitive Approach Discussed,2023-05-10 08:15:01+00:00,349162,10815,456,20.45,False,Wednesday,8,60,0.03228014503296464
take U forward,Reverse Pairs | Hard Interview Question,2023-05-08 08:23:20+00:00,244906,6492,288,32.43,False,Monday,8,39,0.027684091039010886
take U forward,Count Inversions in an Array | Brute and Optimal,2023-05-08 08:17:59+00:00,358599,10530,314,24.28,False,Monday,8,48,0.03023990585584455
take U forward,✅ way to showcase projects in an Tech Interview 💪,2023-05-04 08:19:53+00:00,158046,15127,34,0.98,True,Thursday,8,49,0.09592776786505194
take U forward,❌ do this in a DSA interview without asking!,2023-05-02 14:24:03+00:00,430987,25179,49,1.0,False,Tuesday,14,44,0.05853540826057398
take U forward,Find the Missing and Repeating Number | 4 Approaches 🔥,2023-04-29 15:51:21+00:00,271181,6335,304,42.4,False,Saturday,15,54,0.024481803666186054
take U forward,Hear it out this till the END !!,2023-04-28 23:11:09+00:00,412033,25327,147,0.67,True,Friday,23,32,0.061825145073331506
take U forward,Merge Sorted Arrays Without Extra Space | 2 Optimal Solution,2023-04-27 10:49:18+00:00,321154,9280,341,32.78,False,Thursday,10,60,0.029957590439477634
take U forward,"Merge Overlapping Intervals | Brute, Optimal with Precise TC analysis",2023-04-25 08:30:04+00:00,303762,9178,348,22.58,False,Tuesday,8,69,0.031360077955768
take U forward,Number of Subarrays with xor K | Brute - Better - Optimal,2023-04-25 06:42:05+00:00,222379,7110,214,24.92,False,Tuesday,6,57,0.03293476452362858
take U forward,Dark mode extension for all websites.,2023-04-19 19:35:13+00:00,37418,1853,18,0.45,True,Wednesday,19,37,0.050002672510556415
take U forward,4 Sum | Brute - Better - Optimal with Codes,2023-04-18 15:12:14+00:00,274479,8411,382,28.78,False,Tuesday,15,43,0.03203523766845551
take U forward,Github trick every Software Engineer should know about!,2023-04-17 06:52:27+00:00,65084,4965,29,0.48,True,Monday,6,55,0.07673160838301273
take U forward,3 Sum | Brute -  Better - Optimal with Codes,2023-04-17 06:50:07+00:00,533474,15360,516,38.42,False,Monday,6,44,0.029759650892077216
take U forward,This Leetcode's feature is a scam ❌,2023-04-15 07:52:31+00:00,242094,13801,101,0.98,True,Saturday,7,35,0.0574239758110486
take U forward,Majority Element II | Brute-Better-Optimal,2023-04-14 07:18:31+00:00,314126,9536,413,26.97,False,Friday,7,42,0.03167200422760293
take U forward,1 Crore Salary != Good Software Engineer,2023-04-13 07:36:11+00:00,517287,31694,158,0.97,True,Thursday,7,40,0.061575102409300836
take U forward,ChatGPT trick for converting codes in your language for Interview Preparation,2023-04-07 10:50:11+00:00,126571,7282,48,0.62,True,Friday,10,77,0.057912159973453635
take U forward,Pascal Triangle | Finding nCr in minimal time,2023-04-05 08:28:56+00:00,439286,13523,409,26.75,False,Wednesday,8,45,0.03171510132351133
take U forward,Leetcode Extension to see Company Tags | Interview Preparation,2023-04-05 04:30:05+00:00,194024,16813,74,0.52,True,Wednesday,4,62,0.08703562445882984
take U forward,Count Subarray sum Equals K | Brute - Better -Optimal,2023-04-03 06:56:23+00:00,521387,11845,389,24.15,False,Monday,6,53,0.023464336471757063
take U forward,Spiral Traversal of a Matrix | Spiral Matrix,2023-04-02 12:27:02+00:00,353235,13076,402,16.55,False,Sunday,12,44,0.03815590187835294
take U forward,Rotate Matrix/Image by 90 Degrees | Brute - Optimal,2023-03-30 06:43:45+00:00,374785,12197,349,17.78,False,Thursday,6,51,0.0334751924436677
take U forward,Set Matrix Zeroes | O(1) Space Approach | Brute - Better - Optimal,2023-03-28 09:24:22+00:00,658855,15636,708,30.12,False,Tuesday,9,66,0.024806672181284198
take U forward,Longest Consecutive Sequence | Google Interview Question | Brute Better Optimal,2023-03-27 00:40:34+00:00,428463,11917,535,23.18,False,Monday,0,79,0.02906201935756413
take U forward,Codestudio Weekend Contest 66 Editorial | Live Problem Solving | Striver,2023-03-25 18:00:00+00:00,11385,481,14,79.43,False,Saturday,18,72,0.043478260869565216
take U forward,Leaders in an Array | Brute - Optimal | Strivers A2Z DSA Course,2023-03-24 21:50:00+00:00,227361,7565,384,11.88,False,Friday,21,63,0.03496202075114026
take U forward,Next Permutation - Intuition in Detail 🔥 | Brute to Optimal,2023-03-23 08:23:31+00:00,713571,24205,834,28.25,False,Thursday,8,59,0.035089710764591046
take U forward,Rearrange Array Elements by Sign | 2 Varieties of same Problem,2023-03-18 17:34:15+00:00,340359,10433,485,21.62,False,Saturday,17,62,0.032077894223452294
take U forward,Kadane's Algorithm | Maximum Subarray Sum | Finding and Printing,2023-03-17 20:46:23+00:00,796511,19485,652,20.15,False,Friday,20,64,0.025281508981043577
take U forward,Majority Element I | Brute-Better-Optimal | Moore's Voting Algorithm | Intuition 🔥|Brute to Optimal,2023-03-16 10:07:18+00:00,508373,19697,831,18.22,False,Thursday,10,99,0.0403797998713543
take U forward,Sort an array of 0's 1's & 2's | Intuition of Algo🔥 | C++ Java Python | Brute-Better-Optimal,2023-03-15 07:58:58+00:00,510534,17028,1362,25.12,False,Wednesday,7,92,0.0360211073111683
take U forward,2 Sum Problem | 2 types of the same problem for Interviews | Brute-Better-Optimal,2023-03-14 08:08:11+00:00,665088,14614,604,18.33,False,Tuesday,8,81,0.022881182640492687
